分类,英文短语,短语中文翻译,说明与扩展
环境类短语,pollute the environment,污染环境,"破坏我们的健康 damage our health"
环境类短语,create waste and pollution,产生垃圾废料和污染,"导致健康问题 cause health problems"
环境类短语,increase carbon emissions,（汽车、飞机、工厂等）增加碳排放,"汽车尾气 car fumes；对比：减少碳排放 reduce carbon emissions"
环境类短语,contribute to global warming,（汽车、飞机、工厂等）加剧全球变暖,"加剧气候的变化 contribute to climate change"
环境类短语,put pressure on...,对……（自然资源、医疗体系等）构成压力,"（人口）快速地增长 grow rapidly；崇尚消费的社会 consumer society；对自然资源构成压力 put pressure on natural resources"
环境类短语,reduce biodiversity,减少生物的多样性,"破坏动植物的自然栖息地 destroy natural habitats；拼写：注意 habitat（栖息地）和 habits（习惯）的拼写不同"
环境类短语,become overcrowded,（城市、街道）变得过于拥挤,"城市居民 city dwellers/urban residents"
健康类短语,cause health problems,导致健康问题,"增加患心脏病和高血压的风险 increase the risk of heart disease and high blood pressure"