chinese, phrase
增加患心脏病和高血压的风险, increase the posibility of suffering from heart disease and high blood pressure.
在生活中承受着很大的压力，“压力山大”, suffer from huge pressure 
受到压力和焦虑的困扰, suffer from pressure and anxiety
减轻压力和焦虑, reduce pressure and anxiety
有压力的生活方式, stressful lifestyles
健康的生活方式, health lifestyles
形成环保的生活方式, develop eco-friendly lifestyles
形成缺少运动的生活方式, develop sedentary lifestyles
形成经常运动的生活方式, develop active lifestyles
提高身体的免疫机能, boost the immune system
保持均衡的饮食结构, keep a balanced diet
(快餐)含有过多的脂肪和糖, contain too much sugar and fat
严重依赖于……, heavily rely on
严重依赖于快餐, heavily rely on fastfood
严重依赖于汽车, heavily rely on cars
严重依赖于科技, heavliy rely on technology
(政府、媒体、学校)推广健康的生活方式, promote health lifestyles
鼓励人们去选择健康的食品, encourage people to choose healthy food
改善医疗服务, boost healthcare services
医学研究(名词短语), medical research
缺乏归属感, lack a sense of belonging
感到孤独而且很不开心, feel lonely and unhappy
感到孤独而且很孤立, feel lonely and isolated
崇尚消费的文化, consumer culture
增加对于产品的需求, increase the demand of products
经常过度消费, ofter overshop
购买他们并不真正需要的物品, buy goods which they do not need
欠下债务, owe a debt
集中精力在金钱和财产上面, focus on money and possessions
过于物质化的，过于追求物质享受的, persue enjoyment too much
有良好的消费习惯, have good shopping habits
冲动地购物, shop in pulse
（企业）减少开支, reduce the outcome
（网络商店）提供更低的价格, provide a lower price
价格更合理, a more resonable price
（政府、大学、发达国家等）为……提供资助, provide financial support to
（学校、博物馆等）资金不足, have a limited funds to spend
（政府）还有其它更加急需关注的问题, have other emergence issues to focus on
改善人民的生活水平, improve people live
纳税, pay taxes
政府税收（名词短语）, government tax revenue
对经济做出贡献，例如广告、历史建筑、旅游业, contribute to the economy / boost the economy
促进经济的增长, contribute to economic growth
跨国公司, multinational companies
加重……的负担, pose pressure on
加重纳税人的负担, burden tax-payers
加重医疗体系的负担, burden the healthcare system
（国家之间，经济之间）是相互联系的, are interconnected
国际贸易, international business
文化交流, cultural exchage